{
  "$schema": "http://json-schema.org/draft-06/schema#",
  "id": "http://hl7.org/fhir/json-schema/Patient",
  "description": "Demographics and other administrative information about an individual or animal receiving care or other health-related services.",
  "type": "object",
  "required": ["resourceType"],
  "properties": {
    "resourceType": { "const": "Patient" },
    "id": { "type": "string", "description": "Logical id of this artifact" },
    "_id": { "type": "string", "description": "MongoDB primary key" },
    "meta": { "type": "object", "properties": { "versionId": { "type": "string" }, "lastUpdated": { "type": "string" }, "source": { "type": "string" }, "profile": { "type": "array", "items": { "type": "string" } }, "security": { "type": "array", "items": { "type": "object", "properties": { "system": { "type": "string" }, "code": { "type": "string" }, "display": { "type": "string" } } } }, "tag": { "type": "array", "items": { "type": "object", "properties": { "system": { "type": "string" }, "code": { "type": "string" }, "display": { "type": "string" } } } } } },
    "implicitRules": { "type": "string" },
    "language": { "type": "string" },
    "text": { "type": "object", "properties": { "status": { "type": "string" }, "div": { "type": "string" } } },
    "contained": { "type": "array", "items": { "type": "object" } },
    "extension": { "type": "array", "items": { "type": "object" } },
    "modifierExtension": { "type": "array", "items": { "type": "object" } },
    "identifier": { "type": "array", "items": { "type": "object", "properties": { "use": { "type": "string" }, "type": { "type": "object", "properties": { "coding": { "type": "array", "items": { "type": "object", "properties": { "system": { "type": "string" }, "code": { "type": "string" }, "display": { "type": "string" } } } }, "text": { "type": "string" } } }, "system": { "type": "string" }, "value": { "type": "string" }, "period": { "type": "object", "properties": { "start": { "type": "string" }, "end": { "type": "string" } } }, "assigner": { "type": "object", "properties": { "reference": { "type": "string" }, "display": { "type": "string" } } } } } },
    "active": { "type": "boolean" },
    "name": { "type": "array", "items": { "type": "object", "properties": { "use": { "type": "string" }, "text": { "type": "string" }, "family": { "type": "string" }, "given": { "type": "array", "items": { "type": "string" } }, "prefix": { "type": "array", "items": { "type": "string" } }, "suffix": { "type": "array", "items": { "type": "string" } }, "period": { "type": "object", "properties": { "start": { "type": "string" }, "end": { "type": "string" } } } } } },
    "telecom": { "type": "array", "items": { "type": "object", "properties": { "system": { "type": "string" }, "value": { "type": "string" }, "use": { "type": "string" }, "rank": { "type": "integer" }, "period": { "type": "object", "properties": { "start": { "type": "string" }, "end": { "type": "string" } } } } } },
    "gender": { "type": "string", "enum": ["male", "female", "other", "unknown"] },
    "birthDate": { "type": "string" },
    "deceasedBoolean": { "type": "boolean" },
    "deceasedDateTime": { "type": "string" },
    "address": { "type": "array", "items": { "type": "object", "properties": { "use": { "type": "string" }, "type": { "type": "string" }, "text": { "type": "string" }, "line": { "type": "array", "items": { "type": "string" } }, "city": { "type": "string" }, "district": { "type": "string" }, "state": { "type": "string" }, "postalCode": { "type": "string" }, "country": { "type": "string" }, "period": { "type": "object", "properties": { "start": { "type": "string" }, "end": { "type": "string" } } } } } },
    "maritalStatus": { "type": "object", "properties": { "coding": { "type": "array", "items": { "type": "object", "properties": { "system": { "type": "string" }, "code": { "type": "string" }, "display": { "type": "string" } } } }, "text": { "type": "string" } } },
    "multipleBirthBoolean": { "type": "boolean" },
    "multipleBirthInteger": { "type": "integer" },
    "photo": { "type": "array", "items": { "type": "object", "properties": { "contentType": { "type": "string" }, "language": { "type": "string" }, "data": { "type": "string" }, "url": { "type": "string" }, "size": { "type": "integer" }, "hash": { "type": "string" }, "title": { "type": "string" }, "creation": { "type": "string" } } } },
    "contact": { "type": "array", "items": { "type": "object", "properties": { "relationship": { "type": "array", "items": { "type": "object", "properties": { "coding": { "type": "array", "items": { "type": "object", "properties": { "system": { "type": "string" }, "code": { "type": "string" }, "display": { "type": "string" } } } }, "text": { "type": "string" } } } }, "name": { "type": "object", "properties": { "use": { "type": "string" }, "text": { "type": "string" }, "family": { "type": "string" }, "given": { "type": "array", "items": { "type": "string" } }, "prefix": { "type": "array", "items": { "type": "string" } }, "suffix": { "type": "array", "items": { "type": "string" } } } }, "telecom": { "type": "array", "items": { "type": "object", "properties": { "system": { "type": "string" }, "value": { "type": "string" }, "use": { "type": "string" } } } }, "address": { "type": "object", "properties": { "use": { "type": "string" }, "type": { "type": "string" }, "text": { "type": "string" }, "line": { "type": "array", "items": { "type": "string" } }, "city": { "type": "string" }, "district": { "type": "string" }, "state": { "type": "string" }, "postalCode": { "type": "string" }, "country": { "type": "string" } } }, "gender": { "type": "string" }, "organization": { "type": "object", "properties": { "reference": { "type": "string" }, "display": { "type": "string" } } }, "period": { "type": "object", "properties": { "start": { "type": "string" }, "end": { "type": "string" } } } } } },
    "communication": { "type": "array", "items": { "type": "object", "properties": { "language": { "type": "object", "properties": { "coding": { "type": "array", "items": { "type": "object", "properties": { "system": { "type": "string" }, "code": { "type": "string" }, "display": { "type": "string" } } } }, "text": { "type": "string" } } }, "preferred": { "type": "boolean" } } } },
    "generalPractitioner": { "type": "array", "items": { "type": "object", "properties": { "reference": { "type": "string" }, "display": { "type": "string" } } } },
    "managingOrganization": { "type": "object", "properties": { "reference": { "type": "string" }, "display": { "type": "string" } } },
    "link": { "type": "array", "items": { "type": "object", "properties": { "other": { "type": "object", "properties": { "reference": { "type": "string" }, "display": { "type": "string" } } }, "type": { "type": "string", "enum": ["replaced-by", "replaces", "refer", "seealso"] } } } }
  }
}
