{
  "resourceType": "Patient",
  "id": "patient-john-doe-01",
  "meta": {
    "profile": [
      "http://hl7.org/fhir/us/core/StructureDefinition/us-core-patient|6.1.0"
    ]
  },
  "language": "en",
  "text": {
    "status": "generated",
    "div": "<div xmlns=\"http://www.w3.org/1999/xhtml\" xml:lang=\"en\" lang=\"en\"><p class=\"res-header-id\"><b>Generated Narrative: Patient patient-john-doe-01</b></p><a name=\"patient-john-doe-01\"> </a><a name=\"hcpatient-john-doe-01\"> </a><div style=\"display: inline-block; background-color: #d9e0e7; padding: 6px; margin: 4px; border: 1px solid #8da1b4; border-radius: 5px; line-height: 60%\"><p style=\"margin-bottom: 0px\">Language: en</p><p style=\"margin-bottom: 0px\">Profile: <a href=\"http://hl7.org/fhir/us/core/STU6.1/StructureDefinition-us-core-patient.html\">US Core Patient Profile</a> version: 6.1.0</p></div><p style=\"border: 1px #661aff solid; background-color: #e6e6ff; padding: 10px;\">John Doe  Male, DoB: 1950-01-01 ( Patient's Medicare number)</p><hr/><table class=\"grid\"><tr><td style=\"background-color: #f3f5da\" title=\"Record is active\">Active:</td><td colspan=\"3\">true</td></tr></table></div>"
  },
  "identifier": [
    {
      "type": {
        "coding": [
          {
            "system": "http://terminology.hl7.org/CodeSystem/v2-0203",
            "code": "MC"
          }
        ]
      },
      "system": "http://terminology.hl7.org/NamingSystem/cmsMBI",
      "value": "1EG4TE5MK73"
    }
  ],
  "active": true,
  "name": [
    {
      "family": "Doe",
      "given": [
        "John"
      ]
    }
  ],
  "gender": "male",
  "birthDate": "1950-01-01"
}